{
  "meta": {
    "version": "0.4",
    "domain": "example_domain",
    "created": "YYYY-MM-DD",
    "purpose": "Define terminology, common misunderstandings, and self-checks.",
    "load_condition": "Always load when this domain is selected."
  },
  "terminology": {
    "standard_terms": [
      {
        "term": "preferred term",
        "definition": "What this term means in this domain. Be operational, not dictionary-like."
      }
    ],
    "banned_terms": [
      {
        "term": "term to avoid",
        "why": "Why this term misleads agent judgment. What wrong assumption it encodes.",
        "replace_with": "A concrete, domain-specific replacement."
      }
    ]
  },
  "misunderstandings": [
    {
      "id": "MS-001",
      "wrong": "Common wrong interpretation that an agent without domain cognition would make.",
      "correct": "The correct interpretation according to this domain's principles.",
      "key_distinction": "The specific conceptual boundary the agent must preserve.",
      "why": "What bad judgment results when the agent holds the wrong interpretation."
    }
  ],
  "self_check": [
    "Did the answer apply the domain's core distinction instead of giving generic advice?",
    "Would a domain expert agree with this judgment, or did the agent default to common sense?"
  ]
}
