{
  "meta": {
    "version": "0.1.0",
    "domain": "your_domain_id",
    "created": "YYYY-MM-DD",
    "purpose": "Common misdiagnoses and self-checks for <domain>.",
    "load_condition": "Always load with KDNA_Core.json."
  },
  "terminology": {
    "standard_terms": [
      {
        "term": "domain_specific_concept",
        "definition": "Operational definition. Not a dictionary definition. What the agent must do, see, or check when this term applies."
      }
    ],
    "banned_terms": [
      {
        "term": "vague_word_agents_default_to",
        "why": "Why using this term in this domain misleads the agent or the user.",
        "replace_with": "the specific, operational alternative",
        "applies_when": ["situation where the substitution matters"]
      }
    ]
  },
  "misunderstandings": [
    {
      "id": "misread_one",
      "wrong": "A specific belief a real agent in this domain might hold. NOT a straw-man.",
      "correct": "What the agent should believe instead. Be operational, not slogan.",
      "key_distinction": "Name the conceptual boundary, not just the negation.",
      "why": "What bad output results when an agent holds the wrong belief.",
      "confidence": "high",
      "evidence_type": ["practice_pattern"],
      "applies_when": [
        "describe situations where this misunderstanding is likely"
      ],
      "does_not_apply_when": [
        "describe situations where this distinction would be a red herring"
      ],
      "failure_risk": "What harm if the agent over-applies this distinction outside its scope."
    }
  ],
  "self_check": [
    "Domain-specific yes/no question 1 the agent should answer about its own output?",
    "Domain-specific yes/no question 2?",
    "Domain-specific yes/no question 3?"
  ]
}
