{
  "meta": {
    "version": "0.2",
    "domain": "writing_basic",
    "created": "2026-05-17",
    "purpose": "Define language patterns, common mistakes, and self-checks for writing judgment.",
    "load_condition": "Always load when writing, editing, or reviewing any text."
  },
  "terminology": {
    "preferred_terms": [
      {
        "term": "reader",
        "definition": "The specific person who will consume this text."
      },
      {
        "term": "structure",
        "definition": "The logical order of ideas that forms the invisible argument."
      },
      {
        "term": "clarity",
        "definition": "The property of being understood on first reading without effort."
      }
    ],
    "banned_terms": [
      {
        "term": "obviously",
        "why": "If something is obvious, stating it wastes the reader's time and suggests the writer doubts their intelligence. If it is not obvious, the word is dishonest.",
        "replace_with": "Remove the word. Let the evidence speak."
      },
      {
        "term": "clearly",
        "why": "Same problem as 'obviously.' It signals the writer is about to skip an explanation.",
        "replace_with": "State the reasoning that makes it clear."
      },
      {
        "term": "in order to",
        "why": "Adds three words where 'to' suffices. Cognitive tax with zero semantic return.",
        "replace_with": "'to'"
      },
      {
        "term": "it is important to note that",
        "why": "If it is important, the reader will notice. If the reader won't notice, the writing failed. Either way, the phrase adds nothing.",
        "replace_with": "Delete the phrase entirely and state what is important directly."
      },
      {
        "term": "very / really / quite",
        "why": "Intensifiers substitute for precision. 'Very large' is weaker than 'eleven percent larger.'",
        "replace_with": "Use a specific number, comparison, or concrete detail."
      }
    ]
  },
  "misunderstandings": [
    {
      "id": "MS-001",
      "wrong": "Good writing requires complex vocabulary and sophisticated sentence structures.",
      "correct": "Good writing uses the simplest word that carries the precise meaning and the shortest sentence that conveys the complete thought.",
      "key_distinction": "Complexity of vocabulary is not complexity of thinking. Precise simple words demonstrate deeper understanding than vague complex ones.",
      "why": "Prioritizing complexity over precision produces writing that impresses superficial readers but fails with careful ones."
    },
    {
      "id": "MS-002",
      "wrong": "Editing means fixing grammar and typos.",
      "correct": "Editing means testing whether each sentence, paragraph, and section earns its place in the reader's understanding. Grammar is the last and least important step.",
      "key_distinction": "Copy-editing (surface) vs. structural editing (substance).",
      "why": "Writers who treat editing as proofreading never fix the structural problems that actually prevent clarity."
    },
    {
      "id": "MS-003",
      "wrong": "Longer articles are more authoritative.",
      "correct": "Articles are exactly as long as they need to be and not a word longer. Authority comes from precision, not volume.",
      "key_distinction": "Length is an output, not a goal. If an idea takes 300 words, 1000 words insult the reader.",
      "why": "Padding for perceived authority produces writing that readers skim instead of read."
    }
  ],
  "self_check": [
    "Can each sentence be understood on first reading by the intended reader?",
    "Does every paragraph serve exactly one clear idea?",
    "Are there any words that could be removed without changing the meaning?",
    "Would a skeptical reader accept the claims without asking for evidence?"
  ]
}
